{
  "enabled": false,
  "min_recharge_amount": 1,
  "max_recharge_amount": 0,
  "daily_recharge_limit": 0,
  "order_timeout_minutes": 5,
  "max_pending_orders": 3,
  "enabled_payment_types": ["alipay", "wxpay"],
  "load_balance_strategy": "round-robin",
  "balance_payment_disabled": false,
  "balance_recharge_multiplier": 1,
  "recharge_fee_rate": 0,
  "product_name_prefix": "",
  "product_name_suffix": "",
  "help_image_url": "",
  "help_text": "",
  "cancel_rate_limit_enabled": false,
  "cancel_rate_limit_max": 5,
  "cancel_rate_limit_window": 1,
  "cancel_rate_limit_unit": "hour",
  "cancel_rate_limit_window_mode": "rolling",
  "visible_method_alipay_source": "official",
  "visible_method_wxpay_source": "official",
  "visible_method_alipay_enabled": true,
  "visible_method_wxpay_enabled": true,
  "resume_signing_key_hex": ""
}
